{
  "schema_version": "1.0",
  "generated_at": "2026-08-13T03:52:00.684Z",
  "preview_kind": "generic_procedural_choreography_demonstration",
  "width": 960,
  "height": 540,
  "fps": 30,
  "has_audio": true,
  "previews": [
    {
      "id": "AR01-01",
      "family_id": "AR01",
      "group_code": "AR",
      "status": "ready",
      "video": "previews/videos/AR/AR01-01.mp4",
      "poster": "previews/posters/AR/AR01-01.webp",
      "duration_s": 2,
      "fps": 30,
      "width": 960,
      "height": 540,
      "has_audio": true,
      "size_bytes": 97051,
      "sha256": "2bfaf82c7d4a48a8e3f0ea1c86efda9fa67245d282496bbb1b93a97e096da7cd",
      "poster_size_bytes": 14654,
      "poster_sha256": "46693201df592cf835b355823df028ea1b39991ed3c86a040daefa1ba5c83789",
      "poster_time_s": 1.32,
      "spatial_mode": "oblique_split",
      "settle_mode": "soft_oblique_hold",
      "text_projection": "screen_facing",
      "provenance": "procedural_svg_choreography_v2_spatial"
    },
    {
      "id": "AR01-02",
      "family_id": "AR01",
      "group_code": "AR",
      "status": "ready",
      "video": "previews/videos/AR/AR01-02.mp4",
      "poster": "previews/posters/AR/AR01-02.webp",
      "duration_s": 2,
      "fps": 30,
      "width": 960,
      "height": 540,
      "has_audio": true,
      "size_bytes": 94773,
      "sha256": "0c4ed41663f8b8e1438b252615e0ab576585290e443016cfa016b93f141dfa71",
      "poster_size_bytes": 14306,
      "poster_sha256": "89b01cd34d81e1dc8515c403f9f58b44e1aa7891360a920744d1d95842e50f5b",
      "poster_time_s": 1.32,
      "spatial_mode": "oblique_split",
      "settle_mode": "soft_oblique_hold",
      "text_projection": "screen_facing",
      "provenance": "procedural_svg_choreography_v2_spatial"
    },
    {
      "id": "AR01-03",
      "family_id": "AR01",
      "group_code": "AR",
      "status": "ready",
      "video": "previews/videos/AR/AR01-03.mp4",
      "poster": "previews/posters/AR/AR01-03.webp",
      "duration_s": 3.266667,
      "fps": 30,
      "width": 960,
      "height": 540,
      "has_audio": true,
      "size_bytes": 108209,
      "sha256": "592d35d50abb6a5d997acfa14b6de312abdb1317a0af25c108714d52c304ad91",
      "poster_size_bytes": 11632,
      "poster_sha256": "4e47369fedc0e138385bb31dd0359bb7b88d9b3d4c8acaa4f12f93eb796dc7db",
      "poster_time_s": 2.548,
      "spatial_mode": "frontal",
      "settle_mode": "soft_oblique_hold",
      "text_projection": "screen_facing",
      "provenance": "procedural_svg_choreography_v2_spatial"
    },
    {
      "id": "AR01-04",
      "family_id": "AR01",
      "group_code": "AR",
      "status": "ready",
      "video": "previews/videos/AR/AR01-04.mp4",
      "poster": "previews/posters/AR/AR01-04.webp",
      "duration_s": 3.266667,
      "fps": 30,
      "width": 960,
      "height": 540,
      "has_audio": true,
      "size_bytes": 114879,
      "sha256": "272f6d4e2a4246b287fe64f6c5978b7aeac18237272d4db3a50dbf0cb1ca9688",
      "poster_size_bytes": 11248,
      "poster_sha256": "46dd21f14a4ae34f72f7ef9b4511247240a24257b02f69207055a2ec0fd881e4",
      "poster_time_s": 2.548,
      "spatial_mode": "frontal",
      "settle_mode": "soft_oblique_hold",
      "text_projection": "screen_facing",
      "provenance": "procedural_svg_choreography_v2_spatial"
    },
    {
      "id": "AR01-05",
      "family_id": "AR01",
      "group_code": "AR",
      "status": "ready",
      "video": "previews/videos/AR/AR01-05.mp4",
      "poster": "previews/posters/AR/AR01-05.webp",
      "duration_s": 3.266667,
      "fps": 30,
      "width": 960,
      "height": 540,
      "has_audio": true,
      "size_bytes": 108801,
      "sha256": "190f08468a81ad41b6a25df63f9a886acc2f4f09cf7ed204f002103a2e3d5915",
      "poster_size_bytes": 10942,
      "poster_sha256": "8972e615f6193961d12736b75278fc8429f7ab33b02a2d7bb59bbba2e85bfd1b",
      "poster_time_s": 2.548,
      "spatial_mode": "frontal",
      "settle_mode": "soft_oblique_hold",
      "text_projection": "screen_facing",
      "provenance": "procedural_svg_choreography_v2_spatial"
    },
    {
      "id": "AR01-06",
      "family_id": "AR01",
      "group_code": "AR",
      "status": "ready",
      "video": "previews/videos/AR/AR01-06.mp4",
      "poster": "previews/posters/AR/AR01-06.webp",
      "duration_s": 3.266667,
      "fps": 30,
      "width": 960,
      "height": 540,
      "has_audio": true,
      "size_bytes": 126713,
      "sha256": "c150a8f78b0ef8bcbf5fd0f5daf6ad811ead88a592a148d7b6ddefe74d634303",
      "poster_size_bytes": 13950,
      "poster_sha256": "29915170a301c1ec80b0e14ad000346d5bbb5514f8534057deee94313d215c83",
      "poster_time_s": 2.156,
      "spatial_mode": "oblique_split",
      "settle_mode": "soft_oblique_hold",
      "text_projection": "screen_facing",
      "provenance": "procedural_svg_choreography_v2_spatial"
    },
    {
      "id": "AR01-07",
      "family_id": "AR01",
      "group_code": "AR",
      "status": "ready",
      "video": "previews/videos/AR/AR01-07.mp4",
      "poster": "previews/posters/AR/AR01-07.webp",
      "duration_s": 5.2,
      "fps": 30,
      "width": 960,
      "height": 540,
      "has_audio": true,
      "size_bytes": 193316,
      "sha256": "99b5b1b63706a13c3043a3243c4a86c2f5cbb851bfdfa163c3eaf56d91900591",
      "poster_size_bytes": 14772,
      "poster_sha256": "d88a0f24555526efd7f0ec0de6158e492efaaedabaf1b18523a3cff63b8150fd",
      "poster_time_s": 3.432,
      "spatial_mode": "oblique_split",
      "settle_mode": "soft_oblique_hold",
      "text_projection": "screen_facing",
      "provenance": "procedural_svg_choreography_v2_spatial"
    },
    {
      "id": "AR01-08",
      "family_id": "AR01",
      "group_code": "AR",
      "status": "ready",
      "video": "previews/videos/AR/AR01-08.mp4",
      "poster": "previews/posters/AR/AR01-08.webp",
      "duration_s": 5.2,
      "fps": 30,
      "width": 960,
      "height": 540,
      "has_audio": true,
      "size_bytes": 180851,
      "sha256": "4fe079d62bfe29ad9b6dd959251b7c382f1b2c9cbc984d3f16a637765e5b5e1c",
      "poster_size_bytes": 11670,
      "poster_sha256": "b7a78c759157323e1292b78e28187bea82f9e14dcabcd0c18e28c696481eacac",
      "poster_time_s": 3.432,
      "spatial_mode": "yaw_right",
      "settle_mode": "soft_oblique_hold",
      "text_projection": "screen_facing",
      "provenance": "procedural_svg_choreography_v2_spatial"
    },
    {
      "id": "AR02-01",
      "family_id": "AR02",
      "group_code": "AR",
      "status": "ready",
      "video": "previews/videos/AR/AR02-01.mp4",
      "poster": "previews/posters/AR/AR02-01.webp",
      "duration_s": 1.166667,
      "fps": 30,
      "width": 960,
      "height": 540,
      "has_audio": true,
      "size_bytes": 67542,
      "sha256": "dae2154a14fc451fe8037aa70dd881be39f35e60dd37585cb152cccdbc753f62",
      "poster_size_bytes": 14066,
      "poster_sha256": "2a754cfa418cd277b638c123491abbd9f865f30e86d0f7f91caa7d1102577743",
      "poster_time_s": 0.77,
      "spatial_mode": "oblique_split",
      "settle_mode": "soft_oblique_hold",
      "text_projection": "screen_facing",
      "provenance": "procedural_svg_choreography_v2_spatial"
    },
    {
      "id": "AR02-02",
      "family_id": "AR02",
      "group_code": "AR",
      "status": "ready",
      "video": "previews/videos/AR/AR02-02.mp4",
      "poster": "previews/posters/AR/AR02-02.webp",
      "duration_s": 2,
      "fps": 30,
      "width": 960,
      "height": 540,
      "has_audio": true,
      "size_bytes": 90972,
      "sha256": "5c9e4f0b90812a72491ff558762b7043ddbfd5ba7991129de53a2ae32609e63f",
      "poster_size_bytes": 11792,
      "poster_sha256": "43f7664efe206fc42132e1b0a15739137e39246ad7e85c032f8b6994c5bbbda7",
      "poster_time_s": 1.32,
      "spatial_mode": "yaw_left",
      "settle_mode": "soft_oblique_hold",
      "text_projection": "screen_facing",
      "provenance": "procedural_svg_choreography_v2_spatial"
    },
    {
      "id": "AR02-03",
      "family_id": "AR02",
      "group_code": "AR",
      "status": "ready",
      "video": "previews/videos/AR/AR02-03.mp4",
      "poster": "previews/posters/AR/AR02-03.webp",
      "duration_s": 2,
      "fps": 30,
      "width": 960,
      "height": 540,
      "has_audio": true,
      "size_bytes": 77821,
      "sha256": "25825f15d66cbf8c476437da5e3e43c50c840e0d62479bdf8c59ea74f704c14e",
      "poster_size_bytes": 10734,
      "poster_sha256": "79aaa5128ad2e6848e35113fcbae3f40b3451457289703c9f2e1484f8017f337",
      "poster_time_s": 1.56,
      "spatial_mode": "frontal",
      "settle_mode": "soft_oblique_hold",
      "text_projection": "screen_facing",
      "provenance": "procedural_svg_choreography_v2_spatial"
    },
    {
      "id": "AR02-04",
      "family_id": "AR02",
      "group_code": "AR",
      "status": "ready",
      "video": "previews/videos/AR/AR02-04.mp4",
      "poster": "previews/posters/AR/AR02-04.webp",
      "duration_s": 2,
      "fps": 30,
      "width": 960,
      "height": 540,
      "has_audio": true,
      "size_bytes": 93893,
      "sha256": "54b0857bcf14c6b4bb36953abcb5c17b1bbf5f7643ed8948b120d0139fac3501",
      "poster_size_bytes": 14696,
      "poster_sha256": "61c42dfa1424055c0c17b7566d65d7667f69eacc5358765cf9e4a0a2316e45b1",
      "poster_time_s": 1.32,
      "spatial_mode": "oblique_split",
      "settle_mode": "soft_oblique_hold",
      "text_projection": "screen_facing",
      "provenance": "procedural_svg_choreography_v2_spatial"
    },
    {
      "id": "AR02-05",
      "family_id": "AR02",
      "group_code": "AR",
      "status": "ready",
      "video": "previews/videos/AR/AR02-05.mp4",
      "poster": "previews/posters/AR/AR02-05.webp",
      "duration_s": 3.266667,
      "fps": 30,
      "width": 960,
      "height": 540,
      "has_audio": true,
      "size_bytes": 127485,
      "sha256": "90308fe56a4e575d8cfc2f4ca35d6b5f681a938b050a4e735ac32960ac6378eb",
      "poster_size_bytes": 14038,